{
  "_type": "https://in-toto.io/Statement/v1",
  "subject": [
    {
      "name": "auth/v0.1.0-t2.1",
      "digest": { "gitCommit": "cccccccccccccccccccccccccccccccccccccccc" }
    }
  ],
  "predicateType": "https://semver-trust.dev/release/v0.2",
  "predicate": {
    "profile": {
      "specification": { "name": "semver-trust", "version": "0.8" },
      "predicate_contract": { "name": "release", "version": "0.2" },
      "evaluator": { "name": "semver-trust-fixture", "version": "0.0.0" },
      "repository_identity": { "name": "fixture-repository", "version": "0.1" },
      "graph": { "name": "fixture-graph", "version": "0.1" },
      "policy": { "name": "fixture-policy", "version": "0.1" },
      "verification_time": { "name": "fixture-clock", "version": "0.1" },
      "verification_instant": "2026-07-12T20:00:00Z"
    },
    "repository": {
      "id": "repo:semver-trust.test/auth",
      "origin": "https://example.test/auth.git",
      "digest": { "sha256": "aaaaaaaaaaaaaaaaaaaaaaaaaaaaaaaaaaaaaaaaaaaaaaaaaaaaaaaaaaaaaaaa" }
    },
    "component": { "name": "auth", "tag_prefix": "auth/" },
    "interval": {
      "mode": "inception",
      "to": { "id": "commit:cccccccccccccccccccccccccccccccccccccccc" },
      "adoption_boundary": null,
      "predecessor_attestation": null,
      "source_identity": { "gitCommit": "cccccccccccccccccccccccccccccccccccccccc" }
    },
    "policy_state": {
      "active_policy": {
        "path": ".semver-trust/policy.toml",
        "digest": { "sha256": "bbbbbbbbbbbbbbbbbbbbbbbbbbbbbbbbbbbbbbbbbbbbbbbbbbbbbbbbbbbbbbbb" }
      },
      "active_trust_roots": [
        {
          "path": ".semver-trust/allowed_signers",
          "digest": { "sha256": "dddddddddddddddddddddddddddddddddddddddddddddddddddddddddddddddd" }
        }
      ],
      "candidate_policy": null,
      "candidate_trust_roots": [],
      "mandatory_workflows": [
        {
          "path": ".github/workflows/release.yml",
          "digest": { "sha256": "eeeeeeeeeeeeeeeeeeeeeeeeeeeeeeeeeeeeeeeeeeeeeeeeeeeeeeeeeeeeeeee" }
        }
      ],
      "authority": "bootstrap",
      "authority_identity": {
        "uri": "bootstrap:auth",
        "digest": { "sha256": "ffffffffffffffffffffffffffffffffffffffffffffffffffffffffffffffff" }
      }
    },
    "version_state": {
      "action": "advance",
      "genesis": true,
      "predecessor": null,
      "prior_state": null,
      "resulting_state": {
        "id": "version-state:auth:v0.1.0-t2.1",
        "digest": { "sha256": "1111111111111111111111111111111111111111111111111111111111111111" },
        "canonicalization": { "name": "semver-trust-version-state-json", "version": "0.2" }
      },
      "target_core": "0.1.0",
      "target_bump": "minor",
      "emission": {
        "kind": "tag",
        "tag": {
          "name": "auth/v0.1.0-t2.1",
          "raw_ref_oid": "tag-object-1",
          "peeled_commit_oid": "cccccccccccccccccccccccccccccccccccccccc"
        }
      },
      "target_lineage": [{ "id": "interval:auth:inception:1" }],
      "iteration": 1,
      "pending_corrective_floor": null
    },
    "trust": {
      "effective": "T2",
      "own": "T2",
      "floor_sources": []
    },
    "provenance": [
      {
        "sha": "cccccccccccccccccccccccccccccccccccccccc",
        "level": "T2",
        "authorship": {
          "class": "agent",
          "actor": "agent-ci",
          "credential_identity": "agent-ci@semver-trust.test",
          "trailers": { "Provenance": "agent" }
        },
        "review": {
          "class": "human",
          "actor": "alice",
          "attestation": { "id": "review-attestation:1" }
        },
        "derivations": []
      }
    ],
    "evidence": {
      "compatibility": null,
      "blast_radius": { "id": "blast:moderate" },
      "coverage": null
    },
    "decision": {
      "claimed_bump": "minor",
      "semantic_floor": "minor",
      "threshold": "T2",
      "strategy": "demote",
      "channel": "prerelease",
      "supersedes": null
    },
    "timestamp": "2026-07-12T20:00:00Z"
  }
}
